{
  "events": [
    {
      "event_id": "ev:zhaoshi-zhinan",
      "title": "赵氏之难（『赵氏孤儿』本事）",
      "canonical_date": {
        "type": "range",
        "value": [
          "前597",
          "前583"
        ],
        "note": "★date 本身即冲突：史记·赵世家系于晋景公三年（前597）；左传系于成公八年下宫之难（前583）。两端并存，主线取值见 mainline_decision。差14年系同一事件的系年异说，非两次族诛（见 rejected_alternatives）。"
      },
      "event_type": "政变",
      "actors": [
        {
          "person_ref": "per:zhaowu",
          "role": "赵氏孤儿（幸存复兴）",
          "force_ref": "fo:zhao"
        },
        {
          "person_ref": "per:hanjue",
          "role": "保全赵武、请复赵氏田邑（两述皆有）",
          "force_ref": "fo:jin"
        },
        {
          "person_ref": "per:jin-jinggong",
          "role": "晋君（诛赵/立赵）",
          "force_ref": "fo:jin"
        },
        {
          "person_ref": "per:tuoanguijia",
          "role": "灭赵主谋（★仅赵世家）",
          "force_ref": "fo:jin"
        },
        {
          "person_ref": "per:chengying",
          "role": "藏孤、以己子替死（★仅赵世家）",
          "force_ref": "fo:zhao"
        },
        {
          "person_ref": "per:gongsun-chujiu",
          "role": "与程婴谋、就死（★仅赵世家）",
          "force_ref": "fo:zhao"
        }
      ],
      "geo": {
        "place_refs": [
          "pl:xiagong",
          "pl:jin"
        ],
        "route_hint": null,
        "mapstate_hint": null
      },
      "parent_event": null,
      "accounts": [
        "ac:zhaonan-zuozhuan",
        "ac:zhaonan-shiji-jinshijia",
        "ac:zhaonan-shiji-zhaoshijia"
      ],
      "conflicts": [
        "cf:zhaonan-shiji-internal",
        "cf:zhaonan-date",
        "cf:zhaonan-existence",
        "cf:zhaonan-narrative-souhu"
      ],
      "evidence_tier": "E2",
      "tier_override": {
        "rationale": "近源（左传）为单一编年支柱，屠岸贾藏孤情节无近源支撑、晚出敷演——就『屠岸贾/程婴』叙事而言实近 E3；就『赵氏被诛而赵武复兴』骨干而言有左传近源，E2。取骨干 tier=E2，敷演部分在 conflict 内单独标注。",
        "decided_by": "Wiki（亲裁·签署 2026-07-21）",
        "date": "2026-07-21"
      },
      "mainline_account_ref": "ac:zhaonan-zuozhuan",
      "mainline_decision": {
        "choice": "ac:zhaonan-zuozhuan",
        "rationale": "★边界裁定（详 JUDGMENTS.md#F2）：判为『同事异述』——同指赵氏被诛而赵武复兴之本事，屠岸贾/搜孤救孤系晚出敷演，落为 existence/narrative 冲突对象而非另一事件、亦非另一次族诛。主线取左传（近源编年，成公八年·前583）；史记·赵世家戏剧叙事全文保留、走 S12 对勘。前583/前597 之差落为 date 冲突。",
        "decided_by": "Wiki（亲裁·签署 2026-07-21）",
        "date": "2026-07-21"
      }
    }
  ],
  "accounts": [
    {
      "account_id": "ac:zhaonan-zuozhuan",
      "event_ref": "ev:zhaoshi-zhinan",
      "source_id": "src:zuozhuan",
      "locator": {
        "book": "左传",
        "chapter": "成公八年（附成公四年、五年赵婴通赵庄姬事）",
        "section": null,
        "para_ulid": "4YW6S9BRHDQVDGZDYXH2E8Z7HE:1681",
        "note": "待补。下宫之难：晋讨赵同、赵括，赵庄姬谮之；韩厥言于晋侯，立赵武、复其田邑。★无屠岸贾、无程婴藏孤替死。"
      },
      "白文span_refs": [],
      "白话ref": null,
      "extraction": {
        "date_claim": "鲁成公八年 = 前583",
        "actor_claims": [
          "晋讨赵同、赵括（赵氏遭诛）",
          "赵庄姬（赵武之母）谮赵同赵括",
          "韩厥言于晋景公：『成季之勋、宣孟之忠而无后，为善者惧矣』→ 立赵武，复赵氏田邑"
        ],
        "causal_claims": [
          "赵氏内乱（赵婴通庄姬被逐）+ 庄姬谮 → 晋诛赵同赵括 → 韩厥请存赵后"
        ],
        "number_claims": [],
        "dialogue_spans": []
      },
      "genre_note": "近源编年，晋事最可据；无藏孤替死戏剧情节。★mainline 依据。"
    },
    {
      "account_id": "ac:zhaonan-shiji-jinshijia",
      "event_ref": "ev:zhaoshi-zhinan",
      "source_id": "src:shiji",
      "locator": {
        "book": "史记",
        "chapter": "晋世家",
        "section": null,
        "para_ulid": null,
        "note": "★待补。史记·晋世家因袭左传系统：景公时讨赵同赵括、韩厥存赵武，无屠岸贾藏孤。→ 与同书赵世家自相冲突（cf:zhaonan-shiji-internal 首证）。"
      },
      "白文span_refs": [],
      "白话ref": null,
      "extraction": {
        "date_claim": "晋景公时（因袭左传，约前583前后）",
        "actor_claims": [
          "晋景公诛赵同、赵括",
          "韩厥言存赵氏后，立赵武"
        ],
        "causal_claims": [
          "承左传：庄姬谮 + 内乱"
        ],
        "number_claims": [],
        "dialogue_spans": []
      },
      "genre_note": "★史记内部『左传派』一面（取材 src:zuozhuan，见 sources.json derivation_edges）；与赵世家戏剧叙事冲突——归因链首证。"
    },
    {
      "account_id": "ac:zhaonan-shiji-zhaoshijia",
      "event_ref": "ev:zhaoshi-zhinan",
      "source_id": "src:shiji",
      "locator": {
        "book": "史记",
        "chapter": "赵世家",
        "section": null,
        "para_ulid": null,
        "note": "★待补。史记·赵世家戏剧叙事：屠岸贾灭赵氏，程婴与公孙杵臼藏赵武，程婴以己子替死、公孙杵臼就死；后景公立赵武、诛屠岸贾。系于晋景公三年（前597）。→ 与同书晋世家、与左传冲突。★account 全文保留（S12 差异化供给），不因判传说而删。"
      },
      "白文span_refs": [],
      "白话ref": null,
      "extraction": {
        "date_claim": "晋景公三年 = 前597（★与左传前583差14年）",
        "actor_claims": [
          "屠岸贾为司寇，追论赵盾弑君旧案 → 擅灭赵氏于下宫",
          "程婴、公孙杵臼谋藏赵氏孤儿",
          "公孙杵臼抱他人婴就死，程婴以己子代赵武死、匿赵武于山中",
          "十五年后韩厥白于景公，立赵武、反其田邑，诛屠岸贾，程婴自杀报公孙杵臼"
        ],
        "causal_claims": [
          "屠岸贾以赵盾弑灵公旧案为由私怨灭赵 → 藏孤 → 复立复仇"
        ],
        "number_claims": [
          {
            "value": "十五年",
            "unit": "年",
            "quote_span": "居十五年……",
            "display": "《史记·赵世家》载"
          }
        ],
        "dialogue_spans": [
          "（程婴、公孙杵臼谋孤对白；韩厥梦赵盾等——大段可演绎素材，透传导演，只存不消费）"
        ]
      },
      "genre_note": "★晚出敷演/传说化（战国赵人追记，太史公采异闻）；后世戏曲『赵氏孤儿』母题所本。戏剧张力强，正是 S12 对勘的差异化内容供给——全文保留，标晚出敷演，不采入史实骨干。"
    }
  ],
  "conflicts": [
    {
      "conflict_id": "cf:zhaonan-shiji-internal",
      "event_ref": "ev:zhaoshi-zhinan",
      "dimension": "narrative",
      "account_refs": [
        "ac:zhaonan-shiji-jinshijia",
        "ac:zhaonan-shiji-zhaoshijia"
      ],
      "independence_analysis": {
        "independent_witness_count": 0,
        "reasoning": "★归因链首证：史记内部自裂——晋世家（因袭左传，无屠岸贾/搜孤）与赵世家（屠岸贾+搜孤戏剧叙事）自相矛盾。二者同属史记（源系谱同），不构成两重独立见证（计 0）；但『屠岸贾/搜孤』连史记自己的晋世家都不载，是判定该叙事为晚出敷演的第一条内证，先于 date/existence/narrative 三冲突对象。同时：若 locator 只停『史记』书级，此篇内冲突被抹掉——证明 locator 必到篇（§2.2）。",
        "derivation_notes": [
          "同 source_id=src:shiji，chapter 分别为『晋世家』『赵世家』",
          "locator.book 相同、locator.chapter 不同 → 冲突可见性依赖 chapter 级 locator",
          "归因链角色：本条为『赵世家叙事晚出』结论的首证"
        ]
      },
      "mainline_decision": {
        "choice": "以晋世家（左传系统）为史记内可信面；赵世家异叙并陈",
        "rationale": "同书自相冲突显式记录，示 locator-到-篇之必要 + 作归因链首证；不静默取一。",
        "decided_by": "Wiki（亲裁·签署 2026-07-21）",
        "date": "2026-07-21"
      },
      "presentation_hint": "仅记录"
    },
    {
      "conflict_id": "cf:zhaonan-date",
      "event_ref": "ev:zhaoshi-zhinan",
      "dimension": "date",
      "account_refs": [
        "ac:zhaonan-shiji-zhaoshijia",
        "ac:zhaonan-zuozhuan"
      ],
      "independence_analysis": {
        "independent_witness_count": 2,
        "reasoning": "前597（赵世家）vs 前583（左传）两系年，差14年——本 fixture 入选边界的量化指标。左传近源系年可靠度高。★此差为同一事件的系年异说，非两次族诛（见 rejected_alternatives 调和说否弃）。",
        "derivation_notes": [
          "前597 = 晋景公三年（史记·赵世家）",
          "前583 = 鲁成公八年（左传）",
          "两者见 chronology.json resolutions"
        ]
      },
      "mainline_decision": {
        "choice": "前583（左传·成公八年）",
        "rationale": "近源编年系年优先；赵世家前597属戏剧叙事系统，其系年随叙事晚出。",
        "decided_by": "Wiki（亲裁·签署 2026-07-21）",
        "date": "2026-07-21"
      },
      "presentation_hint": "S12对勘"
    },
    {
      "conflict_id": "cf:zhaonan-existence",
      "event_ref": "ev:zhaoshi-zhinan",
      "dimension": "existence",
      "account_refs": [
        "ac:zhaonan-shiji-zhaoshijia",
        "ac:zhaonan-zuozhuan",
        "ac:zhaonan-shiji-jinshijia"
      ],
      "independence_analysis": {
        "independent_witness_count": 1,
        "reasoning": "『屠岸贾追赵盾旧案、擅灭赵氏于下宫』仅史记·赵世家独有；左传与史记·晋世家（因袭左传，非独立）皆无。故屠岸贾灭族之说独立见证 = 1（晚出、无近源支撑），近源编年（左传：晋景公诛赵同赵括系政治清算、无屠岸贾）反证其无。宁碎片：不并入史实骨干。",
        "derivation_notes": [
          "屠岸贾仅见赵世家（persons.json per:tuoanguijia active_range 已标）",
          "ac:zhaonan-shiji-jinshijia ← src:zuozhuan → 与左传不另计"
        ]
      },
      "mainline_decision": {
        "choice": "存录为异说，不采入史实骨干（骨干以左传『晋诛赵同赵括』为准）",
        "rationale": "近源无、晚出敷演 → 判传说增饰，宁碎片不并；作一等冲突对象 S12 并陈。",
        "decided_by": "Wiki（亲裁·签署 2026-07-21）",
        "date": "2026-07-21"
      },
      "presentation_hint": "S12对勘"
    },
    {
      "conflict_id": "cf:zhaonan-narrative-souhu",
      "event_ref": "ev:zhaoshi-zhinan",
      "dimension": "narrative",
      "account_refs": [
        "ac:zhaonan-shiji-zhaoshijia",
        "ac:zhaonan-zuozhuan",
        "ac:zhaonan-shiji-jinshijia"
      ],
      "independence_analysis": {
        "independent_witness_count": 1,
        "reasoning": "搜孤救孤情节（程婴、公孙杵臼谋藏赵武；公孙杵臼抱他人婴就死；程婴以己子代赵武死、匿孤于山十五年；后立赵武、诛屠岸贾、程婴自杀报公孙杵臼）仅史记·赵世家独有；左传『韩厥言于晋侯、立赵武、复田』无藏孤替死。独立见证 = 1（晚出敷演），近源反证其无。此即后世戏曲『赵氏孤儿』母题所本——传说层增饰，S12 差异化供给的金矿，不作史实。",
        "derivation_notes": [
          "程婴/公孙杵臼仅见赵世家（persons.json 已标）",
          "『居十五年』number_claim 属戏剧叙事内部时序，非独立系年"
        ]
      },
      "mainline_decision": {
        "choice": "存录为异说，不采入史实骨干",
        "rationale": "搜孤救孤为晚出敷演/戏剧母题，宁缺毋附会不并入史实；全文保留于 ac:zhaonan-shiji-zhaoshijia 供 S12 对勘。",
        "decided_by": "Wiki（亲裁·签署 2026-07-21）",
        "date": "2026-07-21"
      },
      "presentation_hint": "S12对勘"
    }
  ],
  "rejected_alternatives": [
    {
      "id": "reject:zhaonan-tiaohe-two-purges",
      "claim": "调和说（两次族诛）：谓左传前583下宫之难与史记·赵世家前597屠岸贾灭赵为两次独立的赵氏族诛（前597一次、前583一次），如此两说皆真、并不冲突。",
      "verdict": "否弃",
      "reason": "前597屠岸贾灭族无任何近源支撑（左传、史记·晋世家俱无，见 cf:zhaonan-shiji-internal 首证），调和说为消弭14年系年矛盾而虚构第二次族诛，凭空增殖无佐证的历史实体（违 parsimony / 宁缺毋附会）。本 fixture 判前597/前583为同一事件之系年异说（落 cf:zhaonan-date），非两桩史实——把源系年分歧误当两次真实族诛，正是同一性判定要防的错（似真而非）。",
      "decided_by": "Wiki（亲裁·签署 2026-07-21）"
    }
  ]
}
